번호,도서명,저자,분류,추천 대상,분류번호
1107,슈슈씨의 범인 찾기,이경순 지음 / 이수영 그림,아동,"탐정 놀이를 통해 추리력과 관찰력을 기르며 문제 해결 능력을 향상시키고 싶어하는 추리 게임 교육 가족들",H181
1108,안 본 눈 삽니다,제성은 지음 / 정은선 그림,아동,"독특한 상상력의 이야기를 통해 창의적 사고와 유머 감각을 기르고 싶어하는 창의적 유머 추구 가족들",H182
1109,재까닥 캠프,김점선 지음 / 국민지 그림,아동,"캠프에서의 다양한 체험과 친구들과의 우정을 통해 협동심과 사회성을 기르고 싶어하는 체험 활동 교육 가족들",H183
1110,탄소 중립이 뭐예요?,장성익 지음 / 방상호 그림,아동,"탄소 중립의 개념을 쉽게 이해하며 환경 보호 실천 방법을 배우고 싶어하는 환경 과학 교육 가족들",H184
1111,오 마이 갓 주식회사,백정애 지음 / 김이주 그림,아동,"주식회사와 경제 활동을 재미있게 배우며 경제 개념과 사회 구조를 이해하고 싶어하는 경제 교육 입문 가족들",H185
1112,스티커 토끼,가브리엘라 케셀만 지음 / 테레사 노보아 그림 / 김영주 옮김,아동,"스티커로 꾸며진 토끼의 이야기를 통해 예술적 표현과 창의성을 기르고 싶어하는 예술 활동 교육 가족들",H186
1113,기억을 파는 향기 가게,신은영 지음 / 김다정 그림,아동,"향기와 기억의 신비한 연결을 다룬 판타지를 통해 감성과 상상력을 풍부하게 하고 싶어하는 감성 판타지 애호가 가족들",H187
1114,찰리와 초콜릿 공장,로알드 달 지음 / 퀸틴 블레이크 그림,아동,"마법 같은 초콜릿 공장에서의 모험을 통해 상상력과 선악에 대한 교훈을 배우고 싶어하는 상상력 모험 추구 가족들",H188
1115,엽기 과학자 프래니_투명 인간이 된 프래니,짐 벤튼 지음 / 김수현 옮김,아동,"과학 실험을 좋아하는 소녀의 엽기적 모험을 통해 과학에 대한 흥미와 창의성을 기르고 싶어하는 과학 실험 교육 가족들",H189
1116,간니닌니 마법의 도서관,지유리 지음 / 이경희 그림,아동,"마법의 도서관에서 벌어지는 신기한 일들을 통해 독서의 즐거움과 상상력을 기르고 싶어하는 독서 판타지 애호가 가족들",H190
1117,오싹오싹 무서운 이야기 1,"잇츠플레이· GBN 지음 / GBN 그림",아동,"적당한 스릴과 긴장감을 즐기며 용기와 문제 해결 능력을 기르고 싶어하는 스릴러 입문 가족들",H191
1118,명탐정 셜록 홈즈의 모험,아서 코난 도일 지음 / 엔터스코리아 옮김,아동,"세계 최고의 명탐정 홈즈의 추리를 통해 논리적 사고력과 관찰력을 기르고 싶어하는 추리 소설 입문 가족들",H192
1119,명탐정 셜록 홈즈의 귀환,아서 코난 도일 지음 / 엔터스코리아 옮김,아동,"홈즈의 화려한 복귀와 새로운 사건들을 통해 추리력과 끈기를 배우고 싶어하는 추리 모험 애호가 가족들",H193
1120,셜록 홈즈의 최후의 인사,아서 코난 도일 지음 / 엔터스코리아 옮김,아동,"홈즈의 마지막 활약을 통해 완결된 추리의 묘미와 우정의 가치를 느끼고 싶어하는 추리 문학 완주 가족들",H194
1121,명탐정 셜록 홈즈의 사건집,아서 코난 도일 지음 / 엔터스코리아 옮김,아동,"다양한 사건들의 해결 과정을 통해 분석적 사고와 문제 해결 능력을 종합적으로 기르고 싶어하는 추리 분석 교육 가족들",H195
1122,주홍색 연구,아서 코난 도일 지음 / 엔터스코리아 옮김,아동,"홈즈와 왓슨의 첫 만남과 사건 해결을 통해 우정과 협력의 가치를 배우고 싶어하는 우정과 협력 교육 가족들",H196
1123,네 개의 서명,아서 코난 도일 지음 / 엔터스코리아 옮김,아동,"복잡한 미스터리의 해결 과정을 통해 인내심과 체계적 사고를 기르고 싶어하는 체계적 사고 교육 가족들",H197
1124,바스커빌 가문의 개,아서 코난 도일 지음 / 엔터스코리아 옮김,아동,"고딕적 분위기의 미스터리를 통해 용기와 진실 추구 정신을 배우고 싶어하는 고딕 미스터리 애호가 가족들",H198
1125,셜록 홈즈의 공포의 계곡,아서 코난 도일 지음 / 엔터스코리아 옮김,아동,"스릴 넘치는 사건의 전말을 통해 정의감과 악에 맞서는 용기를 기르고 싶어하는 정의감 교육 추구 가족들",H199
1126,괴도 신사 뤼팽,모리스 르블랑 지음 / 엔터스코리아 옮김,아동,"매력적인 괴도의 활약을 통해 기지와 창의성· 그리고 정의감을 배우고 싶어하는 괴도 로맨스 애호가 가족들",H200
1127,뤼팽과 숌즈의 대결,모리스 르블랑 지음 / 엔터스코리아 옮김,아동,"명탐정과 괴도의 두뇌 대결을 통해 치밀한 전략과 지적 게임을 즐기고 싶어하는 지적 게임 애호가 가족들",H201
1128,괴도신사 뤼팽의 기암성의 비밀,모리스 르블랑 지음 / 엔터스코리아 옮김,아동,"성에 숨겨진 비밀을 파헤치는 모험을 통해 호기심과 탐구 정신을 기르고 싶어하는 비밀 탐구 모험 가족들",H202
1129,수정마개의 비밀,모리스 르블랑 지음 / 엔터스코리아 옮김,아동,"신비한 수정마개를 둘러싼 사건을 통해 추리력과 상상력을 함께 기르고 싶어하는 미스터리 판타지 애호가 가족들",H203
1130,뤼팽의 고백,모리스 르블랑 지음 / 엔터스코리아 옮김,아동,"괴도의 진솔한 고백을 통해 인간의 복잡한 내면과 선악의 경계를 탐구하고 싶어하는 인간 심리 탐구 가족들",H204
1131,괴도신사 뤼팽의 대모험,모리스 르블랑 지음 / 엔터스코리아 옮김,아동,"뤼팽의 웅장한 모험담을 통해 모험 정신과 불굴의 의지를 배우고 싶어하는 대모험 서사 애호가 가족들",H205
1132,명탐정 셜록 홈즈 1,아서 코난 도일 지음 / 민승기 그림,아동,"어린이를 위해 각색된 홈즈 이야기를 통해 추리의 재미와 논리적 사고를 쉽게 접하고 싶어하는 추리 입문 교육 가족들",H206
1133,저학년 문고 1_꺼벙이 억수,윤수천 지음 / 원유미 그림,아동,"엉뚱하고 순수한 아이의 일상을 통해 아이다운 순수함과 유머를 즐기고 싶어하는 저학년 유머 교육 가족들",H207
1134,저학년 문고 2_병아리반 아이들,홍기 지음 / 유기훈 그림,아동,"새 학급에서의 적응 과정을 통해 친구 사귀기와 학교생활 적응법을 배우고 싶어하는 학교 적응 교육 가족들",H208
1135,저학년 문고 3_엄마 몰래,조성자 지음 / 김준영 그림,아동,"아이들의 작은 비밀과 모험을 통해 독립심과 책임감을 기르고 싶어하는 독립심 교육 추구 가족들",H209
1136,저학년 문고 4_나쁜 엄마,윤수천 지음 / 이경하 그림,아동,"엄마에 대한 복잡한 감정을 다룬 이야기를 통해 가족 관계의 이해와 소통을 배우고 싶어하는 가족 소통 교육 가족들",H210
1137,저학년 문고 5_좁쌀영감 오병수,이상교 지음 / 조현숙 그림,아동,"구두쇠 할아버지의 변화를 통해 나눔과 관대함의 가치를 배우고 싶어하는 나눔 교육 중시 가족들",H211
1138,저학년 문고 6_늦둥이 이른둥이,원유순 지음 / 박기종 그림,아동,"형제자매 간의 차이와 갈등을 통해 개성 존중과 가족애를 배우고 싶어하는 형제자매 관계 교육 가족들",H212
1139,저학년 문고 7_엄마 친구 딸은 괴물,김혜리 지음 / 조현숙 그림,아동,"또래 비교와 질투심을 다룬 이야기를 통해 자존감과 친구 관계를 건강하게 형성하고 싶어하는 자존감 회복 교육 가족들",H213
1140,저학년 문고 8_사막 소년 첸,고정욱 지음 / 김기석 그림,아동,"다문화 친구와의 만남을 통해 문화 다양성과 포용의 가치를 배우고 싶어하는 다문화 이해 교육 가족들",H214
1141,저학년 문고 9_내 짝꿍 김은실,이규희 지음 / 박영미 그림,아동,"짝꿍과의 관계를 통해 협력과 배려의 중요성을 배우고 싶어하는 협력 관계 교육 가족들",H215
1142,저학년 문고 10_뻐꾸기시계의 비밀,고수산나 지음 / 송효정 그림,아동,"신비한 뻐꾸기시계를 통해 시간의 소중함과 가족의 역사를 이해하고 싶어하는 시간과 역사 교육 가족들",H216
1143,저학년 문고 11_길 위의 수호천사,고정욱 지음 / 김중석 그림,아동,"교통안전을 지키는 이야기를 통해 안전 의식과 시민 정신을 기르고 싶어하는 안전 교육 중시 가족들",H217
1144,저학년 문고 12_춤추는 책가방,송언 지음 / 최정인 그림,아동,"마법의 책가방을 통해 학습에 대한 흥미와 상상력을 기르고 싶어하는 학습 동기 부여 교육 가족들",H218
1145,저학년 문고 13_타임머신을 타고 온 선생님,원유순 지음 / 이형진 그림,아동,"미래에서 온 선생님을 통해 교육의 변화와 학습의 즐거움을 발견하고 싶어하는 미래 교육 관심 가족들",H219
1146,저학년 문고 14_엄마 5분만,노경실 지음 / 최정인 그림,아동,"바쁜 엄마와의 관계를 통해 가족 시간의 소중함과 이해심을 기르고 싶어하는 가족 시간 중시 가족들",H220
1147,저학년 문고 15_도깨비가 보낸 초대장,유지은 지음 / 조수경 그림,아동,"도깨비와의 만남을 통해 우리 전통 문화와 상상력을 함께 기르고 싶어하는 전통 판타지 교육 가족들",H221
1148,저학년 문고 16_나팔귀와 땅콩귀,이춘희 지음 / 김은정 그림,아동,"외모에 대한 고민을 다룬 이야기를 통해 자신감과 개성의 소중함을 배우고 싶어하는 외모 콤플렉스 극복 교육 가족들",H222
1149,저학년 문고 17_선생님 몰래,조성자 지음 / 김준영 그림,아동,"선생님과의 관계에서 생기는 작은 비밀들을 통해 학교생활의 재미와 규칙의 의미를 배우고 싶어하는 학교 규칙 교육 가족들",H223
1150,저학년 문고 18_작은북이 동동동,송재찬 지음 / 한수진 그림,아동,"전통 악기를 통한 음악 체험으로 우리 문화의 아름다움과 예술적 감수성을 기르고 싶어하는 전통 음악 교육 가족들",H224
1151,저학년 문고 19_말 잘 듣는 약,유지은 지음 / 박기종 그림,아동,"말 잘 듣는 약이라는 재미있는 설정을 통해 자율성과 책임감의 중요성을 배우고 싶어하는 자율성 교육 중시 가족들",H225
1152,저학년 문고 20_용돈 지갑에 구멍 났나?,고수잔나 지음 / 김미연 그림,아동,"용돈 관리를 통해 경제 개념과 절약의 가치를 재미있게 배우고 싶어하는 경제 교육 실습 가족들",H226
1153,저학년 문고 21_초콜릿색 눈사람,박민호 지음 / 박지영 그림,아동,"특별한 색깔의 눈사람을 통해 다름에 대한 이해와 창의적 사고를 기르고 싶어하는 다양성 인정 교육 가족들",H227
1154,저학년 문고 22_꺼벙이 억수랑 아나바다,윤수천 지음 / 원유미 그림,아동,"아나바다 운동을 통해 환경 보호와 나눔의 정신을 배우고 싶어하는 환경과 나눔 교육 가족들",H228
1155,저학년 문고 23_김칫국 마신 외계인,김진완 지음 / 박희경 그림,아동,"외계인과 한국 음식의 만남을 통해 우리 문화의 우수성과 포용성을 배우고 싶어하는 문화 자긍심 교육 가족들",H229
1156,저학년 문고 24_아드님 진지 드세요,강민경 지음 / 이영림 그림,아동,"예의와 식사 문화를 통해 전통 예절과 가족 관계의 소중함을 배우고 싶어하는 예절 교육 중시 가족들",H230
1157,저학년 문고 25_게임 없이 못 살아!,안미연 지음 / 이용규 그림,아동,"게임 중독 문제를 다룬 이야기를 통해 균형 잡힌 여가 생활과 자제력을 배우고 싶어하는 게임 절제 교육 가족들",H231
1158,저학년 문고 26_친구 몰래,조성자 지음 / 김준영 그림,아동,"친구와의 비밀과 우정을 통해 신뢰 관계와 소통의 중요성을 배우고 싶어하는 우정과 신뢰 교육 가족들",H232
1159,저학년 문고 27_꺼벙이 억수와 꿈을 실은 비행기,윤수천 지음 / 원유미 그림,아동,"꿈을 향한 도전과 노력을 통해 목표 의식과 희망을 기르고 싶어하는 꿈과 희망 교육 가족들",H233
1160,저학년 문고 28_잔소리 없는 엄마를 찾아 주세요,최형미 지음 / 조형윤 그림,아동,"엄마의 잔소리에 대한 이해를 통해 부모의 사랑과 관심의 의미를 깨닫고 싶어하는 부모 자녀 이해 교육 가족들",H234
1161,저학년 문고 29_아빠 몰래,조성자 지음 / 김준영 그림,아동,"아빠와의 특별한 시간과 비밀을 통해 부자 관계의 친밀감을 기르고 싶어하는 부자 관계 개선 교육 가족들",H235
1162,저학년 문고 31_꺼벙이 억수와 방울소리,윤수천 지음 / 원유미 그림,아동,"방울소리가 주는 따뜻한 감동을 통해 소소한 행복과 감사하는 마음을 배우고 싶어하는 감사 교육 중시 가족들",H236
1163,저학년 문고 32_울랄라 아줌마 밴드,박현숙 지음 / 유명희 그림,아동,"음악을 좋아하는 아줌마들의 이야기를 통해 꿈의 나이 제한이 없음을 배우고 싶어하는 평생 꿈 추구 교육 가족들",H237
1164,저학년 문고 33_언니 몰래,조성자 지음 / 김준영 그림,아동,"언니와의 관계에서 생기는 작은 사건들을 통해 형제자매간 이해와 배려를 배우고 싶어하는 형제자매 화목 교육 가족들",H238
1165,저학년 문고 34_아빠의 일기장,유지은 지음 / 조현숙 그림,아동,"아빠의 일기를 통해 부모의 마음과 가족에 대한 사랑을 이해하고 싶어하는 부모 마음 이해 교육 가족들",H239
1166,저학년 문고 35_엄마 어릴 적에,최형미 지음 / 원유미 그림,아동,"엄마의 어린 시절 이야기를 통해 세대 간 공감과 가족사의 소중함을 배우고 싶어하는 세대 공감 교육 가족들",H240
1167,저학년 문고 36_우리 반 오징어 만두 김말이,김경옥 지음/ 전병준 그림,아동,"재미있는 별명을 가진 친구들의 이야기를 통해 개성 존중과 친구 관계를 배우고 싶어하는 개성과 우정 교육 가족들",H241
1168,저학년 문고 37_알 낳는 거짓말,강민경 지음 / 윤희동 그림,아동,"거짓말의 결과를 통해 정직의 중요성과 진실한 소통을 배우고 싶어하는 정직 교육 중시 가족들",H242
1169,저학년 문고 39_칭찬 한 봉지,정진 지음 / 소노수정 그림,아동,"칭찬의 힘을 통해 긍정적 소통과 격려의 가치를 배우고 싶어하는 긍정적 소통 교육 가족들",H243
1170,저학년 문고 40_사람 빌려주는 도서관,박정애 지음 / 서경영 그림,아동,"특별한 도서관을 통해 사람 간의 연결과 도움의 소중함을 배우고 싶어하는 공동체 연대 교육 가족들",H244
1171,저학년 문고 41_쫀쫀 공주의 짜사공,이상교 지음 / 박영 그림,아동,"짜증 많은 공주의 변화를 통해 감정 조절과 성격 개선의 가능성을 배우고 싶어하는 감정 조절 교육 가족들",H245
1172,저학년 문고 42_꺼벙이 억수와 축구왕,윤수천 지음 / 원유미 그림,아동,"축구를 통한 성장과 우정을 배우며 스포츠 정신과 팀워크를 기르고 싶어하는 스포츠 정신 교육 가족들",H246
1173,저학년 문고 43_이유는 백만 가지,최은영 지음 / 김은경 그림,아동,"다양한 핑계와 변명을 통해 책임감과 솔직함의 중요성을 배우고 싶어하는 책임감 교육 중시 가족들",H247
1174,저학년 문고 44_집 바꾸기 게임,안미연 지음 / 조예선 그림,아동,"집을 바꿔 살아보는 상상을 통해 가족의 소중함과 감사하는 마음을 기르고 싶어하는 가족 감사 교육 가족들",H248
1175,저학년 문고 45호기심 대장,서지원 지음 / 백명식 그림,아동,호기심이 넘치는 초등 저학년 아이들과 함께 일상의 작은 질문들에서 큰 발견을 만들어가고 싶은 부모님과 교사들,H249
1176,저학년 문고 46무지개 안경,최형미 지음 / 김형근 그림,아동,다양한 시각으로 세상을 바라보는 법을 배우고 싶은 6-9세 아이들과 아이의 창의적 사고를 키워주고 싶은 부모님,H250
1177,저학년 문고 47엄마의 노란 수첩,양혜원 지음 / 김준영 그림,아동,가족 간의 소통과 이해의 중요성을 느끼고 싶은 초등 저학년 아이들과 바쁜 일상 속에서도 자녀와의 소중한 교감을 찾는 학부모님,H251
1178,"저학년 문고 48아드님, 안녕하세요",강민경 지음 / 이영림 그림,아동,어른스러움과 어린이다움 사이에서 균형을 찾아가는 과정을 공감하며 읽고 싶은 예의 바른 초등학생과 그 부모님,H252
1179,저학년 문고 49오공이 학교에 가다,김리하 지음 / 정경아 그림,아동,학교생활 적응에 어려움을 겪는 아이들에게 용기와 희망을 전하고 친구 관계의 소중함을 느끼게 해주고 싶은 부모님과 교사들,H253
1180,저학년 문고 50엄마는 게임 수업 중,박현숙 지음 / 이상규 그림,아동,디지털 시대를 살아가는 아이들과 부모 사이의 세대 차이를 이해하고 함께 성장하는 방법을 찾고 싶은 가족들,H254
1181,저학년 문고 51남자애들은 왜?,원유순 지음 / 안경희 그림,아동,성별 고정관념에 대해 자연스럽게 생각해보고 다양성을 존중하는 마음을 키우고 싶은 초등 저학년 어린이들과 학부모님,H255
1182,저학년 문고 52여자애들은 왜?,원유순 지음 / 강윤정 그림,아동,성별에 관계없이 자신만의 개성을 존중하고 다름을 이해하는 마음을 배워가는 초등 저학년 어린이와 평등한 가치관을 심어주고 싶은 부모님,H256
1183,저학년 문고 53별난 친구를 소개합니다,조성자 지음 / 조윤희 그림,아동,남다른 개성을 가진 친구들과의 만남을 통해 다양성의 가치를 배우고 진정한 우정을 쌓아가고 싶은 7-9세 아이들,H257
1184,저학년 문고 54쉿! 너만 알고 있어,박현숙 지음 / 권송이 그림,아동,비밀 지키기와 솔직함 사이에서 고민하는 초등 저학년 아이들과 자녀의 정직한 성장을 응원하는 부모님,H258
1185,저학년 문고 55느림보와 번개,정진 지음 / 최덕규 그림,아동,서로 다른 성격과 속도를 가진 친구들 사이의 이해와 협력을 배우며 나만의 페이스를 존중하는 법을 알고 싶은 어린이들,H259
1186,저학년 문고 56방빛나와 수상한 비밀,김수연 지음 / 표주란 그림,아동,호기심 많고 탐정 놀이를 좋아하는 초등학생들과 아이의 상상력과 추리력을 키워주고 싶은 부모님,H260
1187,저학년 문고 57금지어 시합,안근희 지음 / 정세라 그림,아동,언어의 힘과 말의 소중함을 재미있게 배우고 싶은 초등 저학년 아이들과 바른 언어습관을 길러주고 싶은 학부모님과 교사들,H261
1188,저학년 문고 58버럭똥수와 분홍 개구리,김혜연 지음 / 김미연 그림,아동,감정 조절에 어려움을 겪는 아이들이 자신의 감정을 이해하고 표현하는 건강한 방법을 배울 수 있도록 돕고 싶은 부모님과 교사들,H262
1189,저학년 문고 59딸바보 아빠,최은영 지음 / 배종숙 그림,아동,부모와 자녀 간의 사랑과 유대감을 느끼고 싶은 가족들과 특히 아빠와의 관계를 소중히 여기는 마음을 키우고 싶은 어린이들,H263
1190,저학년 문고 60새우눈 가족,박현숙 지음 / 최정인 그림,아동,가족의 다양한 모습과 서로의 개성을 인정하며 함께 성장해가는 이야기를 통해 따뜻한 가족애를 느끼고 싶은 초등학생과 학부모님,H264
1191,1 이 고쳐 선생과 이빨투성이 괴물,롭 루이스 지음,아동,치과 방문에 두려움을 느끼는 어린이들이 재미있는 이야기를 통해 미지의 것에 대한 공포를 극복하는 용기를 배울 수 있도록 돕고 싶은 부모님과 교사들,H265
1192,2 괴물 예절 배우기,조안나 코울 지음 / 재러드 더글라스 리 그림,아동,사회적 규칙과 예의범절을 재미있게 배우고 싶은 어린이들과 예절 교육을 유쾌하게 접근하고 싶은 부모님,H266
1193,3 이 고쳐 선생과 해골투성이 동물,롭 루이스 지음,아동,모험심과 상상력이 풍부한 초등 저학년 어린이들과 두려움을 극복하는 용기의 중요성을 가르치고 싶은 부모님,H267
1194,4 토드 선장과 우주 탐험,제인 욜런 지음 / 브루스 데근 그림,아동,우주와 과학에 호기심 많은 6-9세 어린이들과 상상력 넘치는 모험 이야기를 통해 용기와 협동심을 키워주고 싶은 부모님,H268
1195,5 토드 선장과 포도 행성,제인 욜런 지음 / 브루스 데근 그림,아동,색다른 세계와 이색적인 문화에 관심 많은 어린이들에게 다양성을 존중하는 마음과 모험심을 키워주고 싶은 부모님과 교사들,H269
1196,6 토드 선장과 블랙홀, 제인 욜런 지음 / 브루스 데근 그림,아동,천문학과 우주의 신비에 매료된 초등학생들에게 과학적 호기심과 문제 해결 능력을 키워주는 판타지 모험을 선물하고 싶은 부모님,H270
1197,7 토드 선장과 죽음의 소행성,제인 욜런 지음 / 브루스 데근 그림,아동,위기 상황에서도 지혜와 용기로 문제를 해결해나가는 과정을 통해 긍정적 문제 해결 능력을 배우고 싶은 모험심 많은 초등학생들,H271
1198,8 토드 선장과 우주 해적,제인 욜런 지음 / 브루스 데근 그림,아동,정의와 모험을 사랑하는 7-9세 어린이들과 유머와 상상력이 가득한 우주 이야기를 통해 자녀의 창의력을 자극하고 싶은 부모님,H272
1199,9 토드 선장과 은하계 스파이,제인 욜런 지음 / 브루스 데근 그림,아동,추리와 스파이 이야기를 좋아하는 초등 저학년 아이들에게 논리적 사고와 문제 해결 능력을 키워주는 흥미진진한 모험을 선사하고 싶은 부모님,H273
1200,10 옆집 할머니는 마귀 할멈,제임스 하우스 지음 / 멜리사 스위트 그림,아동,선입견과 편견에 대해 생각해보고 이웃과의 진정한 관계 맺기를 배우고 싶은 초등 저학년 어린이들과 사회성 발달을 돕고 싶은 부모님,H274
1201,11 납작이가 된 스탠리,제프 브라운 지음 / 토미 웅게러 그림,아동,남다른 상황 속에서도 긍정적으로 적응하는 법을 배우고 다양한 관점에서 세상을 바라보는 창의력을 키우고 싶은 7-9세 어린이들,H275
1202,12 위대한 탐정 네이트 잃어버린 열쇠를 찾아서 ,마저리 와인먼 샤매트 지음 / 마르크 시몽 그림,아동,추리력과 관찰력을 키우고 싶은 초등 저학년 어린이들과 문제 해결 과정에서 논리적 사고를 발달시키고 싶은 부모님과 교사들,H276
1203,13 위대한 탐정 네이트 사라진 깡통을 찾아서,마저리 와인먼 샤매트 지음 / 마르크 시몽 그림,아동,작은 물건 하나에도 주의를 기울이는 세심한 관찰력과 끈기를 배우고 싶은 호기심 많은 초등학생들과 자녀의 문제 해결 능력을 키우고 싶은 학부모님,H277
1204,"14 흡혈귀 루디, 치과는 정말 싫어",잉그리트 위베 지음 / 마리아 비스만 그림,아동,치과 방문에 두려움을 느끼는 어린이들에게 유머러스한 이야기로 공포를 극복하게 도와주고 싶은 부모님과 치과의사들,H278
1205,16 투명인간이 된 스탠리,제프 브라운 지음 / 양정아 그림,아동,눈에 보이지 않는 존재의 가치와 소중함을 깨닫고 자신의 존재감을 찾아가는 여정을 함께하고 싶은 자존감 형성 시기의 어린이들,H279
1206,17 안경 끼고 랄랄라,조이 카울리 지음 / 제니퍼 플레카스 그림,아동,자신의 개성을 긍정적으로 받아들이고 자신감을 키워가는 과정을 응원하고 싶은 부모님과 안경을 처음 쓰게 된 어린이들에게 용기를 주고 싶은 분들,H280
1207,"18 바늘 부부, 모험을 떠나다",도바시 에츠코 지음 / 초 신타 그림,아동,평범한 일상에서 벗어나 모험을 꿈꾸는 호기심 많은 어린이들과 새로운 경험의 소중함을 알려주고 싶은 부모님,H281
1208,19 공룡 도시락,재클린 윌슨 지음 / 닉 샤랫 그림,아동,식사 시간을 즐겁게 만들고 싶은 부모님과 음식에 대한 호기심과 식습관을 재미있게 발전시키고 싶은 까다로운 식성의 어린이들,H282
1209,20 꼬마 괴물과 나탈리,재클린 윌슨 지음 / 닉 샤랫 그림,아동,상상 속 친구와의 교감을 통해 정서적 안정감을 찾아가는 과정을 이해하고 싶은 학부모님과 풍부한 상상력을 가진 6-8세 어린이들,H283
