번호,도서명,저자,분류,추천 대상,분류번호
1565,WHY? 화장과 화장품,예림당 편저,기타,화장품의 성분과 원리에 호기심 많은 초등 고학년 학생들과 화학·생활과학에 관심 있는 어린이·청소년들,L284
1566,WHY? 오페라와 뮤지컬,예림당 편저,기타,오페라와 뮤지컬의 역사와 특징에 관심 있는 초등학생들과 공연예술에 대한 이해와 문화적 소양을 키우고 싶은 어린이·청소년들,L285
1567,WHY? 우주,예림당 편저,기타,우주의 신비와 천체의 특성에 호기심 많은 초등학생들과 천문학의 기초를 재미있게 배우고 싶은 어린이·청소년들,L286
1568,WHY? 지구,예림당 편저,기타,지구의 구조와 환경에 관심 있는 초등학생들과 우리가 사는 행성에 대한 과학적 이해를 키우고 싶은 어린이·청소년들,L287
1569,WHY? 핵과 에너지,예림당 편저,기타,핵에너지의 원리와 활용에 호기심 많은 초등 고학년 학생들과 에너지 문제에 대한 균형 있는 시각을 갖고 싶은 어린이·청소년들,L288
1570,WHY? 화석,예림당 편저,기타,화석의 형성 과정과 과학적 가치에 관심 있는 초등학생들과 지질학과 고생물학의 기초를 재미있게 배우고 싶은 어린이·청소년들,L289
1571,WHY? 별과 별자리,예림당 편저,기타,밤하늘의 별과 별자리에 호기심 많은 초등학생들과 천문학의 매력을 자녀와 함께 나누고 싶은 학부모님들,L290
1572,WHY? 남극 북극,예림당 편저,기타,극지방의 환경과 생태계에 관심 있는 초등학생들과 기후 변화와 환경 보호의 중요성을 배우고 싶은 어린이·청소년들,L291
1573,WHY? 날씨,예림당 편저,기타,날씨 현상의 원리와 기상 변화에 호기심 많은 초등학생들과 일상 속 과학 원리를 재미있게 이해하고 싶은 어린이·청소년들,L292
1574,WHY? 공룡,예림당 편저,기타,공룡의 생태와 진화에 관심 많은 초등학생들과 고생물학의 세계를 재미있게 탐험하고 싶은 어린이·청소년들,L293
1575,WHY? 곤충,예림당 편저,기타,곤충의 특성과 생태에 호기심 많은 초등학생들과 작은 생명체의 놀라운 세계를 탐구하고 싶은 어린이·청소년들,L294
1576,WHY? 로켓과 탐사선,예림당 편저,기타,로켓 기술과 우주 탐사에 관심 많은 초등학생들과 항공우주 과학의 원리를 재미있게 배우고 싶은 어린이·청소년들,L295
1577,WHY? 교통수단,예림당 편저,기타,다양한 교통수단의 발전 역사와 원리에 호기심 많은 초등학생들과 과학기술의 발전 과정을 이해하고 싶은 어린이·청소년들,L296
1578,WHY? 생활과학,예림당 편저,기타,일상 속 과학 원리에 관심 있는 초등학생들과 생활 속 과학적 호기심을 채우고 싶은 어린이·청소년들,L297
1579,WHY? 스포츠과학,예림당 편저,기타,스포츠에 숨겨진 과학적 원리에 호기심 많은 초등학생들과 체육과 과학의 연결고리를 재미있게 배우고 싶은 어린이·청소년들,L298
1580,WHY? 실험관찰,예림당 편저,기타,과학 실험과 관찰 방법에 관심 있는 초등학생들과 탐구력과 관찰력을 키우는 과학 교육을 중요시하는 학부모님들과 교사들,L299
1581,WHY? 정보통신,예림당 편저,기타,정보통신 기술의 원리와 발전에 호기심 많은 초등학생들과 디지털 시대의 핵심 기술을 이해하고 싶은 어린이·청소년들,L300
1582,WHY? 컴퓨터,예림당 편저,기타,컴퓨터의 작동 원리와 발전 역사에 관심 있는 초등학생들과 디지털 리터러시를 키우고 싶은 어린이·청소년들,L301
1583,WHY? 옷과 패션,예림당 편저,기타,의복과 패션의 역사와 문화적 의미에 호기심 많은 초등학생들과 의생활 문화에 대한 이해를 넓히고 싶은 어린이·청소년들,L302
1584,만화 바로보는 세계사 01_인류문명의 발자취,주니어김영사 편저,기타,인류 문명의 시작과 발전 과정에 관심 있는 초등학생들과 세계사의 큰 흐름을 재미있게 배우고 싶은 어린이·청소년들,L303
1585,만화 바로보는 세계사 02_동서양 제국의 흥망성쇠,주니어김영사 편저,기타,세계 각국 제국의 흥망성쇠에 호기심 많은 초등 고학년 학생들과 역사의 순환적 특성을 이해하고 싶은 어린이·청소년들,L304
1586,만화 바로보는 세계사 03_중세 유럽의 사회,주니어김영사 편저,기타,중세 유럽의 문화와 사회 구조에 관심 있는 초등 고학년 학생들과 서양 중세사의 특징을 재미있게 배우고 싶은 어린이·청소년들,L305
1587,만화 바로보는 세계사 04_중세 아시아와 아프리카,주니어김영사 편저,기타,중세 시대 아시아와 아프리카 문명에 호기심 많은 초등 고학년 학생들과 비서구권 역사에 대한 균형 있는 시각을 갖고 싶은 어린이·청소년들,L306
1588,만화 바로보는 세계사 05_르네상스와 절대왕정,주니어김영사 편저,기타,르네상스와 절대왕정 시대의 문화와 정치에 관심 있는 초등 고학년 학생들과 유럽 근세사의 흐름을 이해하고 싶은 어린이·청소년들,L307
1589,만화 바로보는 세계사 06_근세 동아시아 제국,주니어김영사 편저,기타,근세 동아시아 각국의 역사와 문화적 특성에 호기심 많은 초등 고학년 학생들과 동아시아사의 큰 흐름을 배우고 싶은 어린이·청소년들,L308
1590,만화 바로보는 세계사 07_유럽의 시민혁명,주니어김영사 편저,기타,프랑스 혁명을 비롯한 유럽의 시민혁명에 관심 있는 초등 고학년 학생들과 근대 민주주의의 태동 과정을 이해하고 싶은 어린이·청소년들,L309
1591,만화 바로보는 세계사 08_유럽과 아시아의 근대화,주니어김영사 편저,기타,유럽과 아시아 각국의 근대화 과정에 호기심 많은 초등 고학년 학생들과 세계사의 연결성과 상호작용을 배우고 싶은 어린이·청소년들,L310
1592,만화 바로보는 세계사 09_제1차 세계대전과 세계 대공황,주니어김영사 편저,기타,20세기 초 세계대전과 경제 대공황의 역사적 의미에 관심 있는 초등 고학년 학생들과 현대사의 배경을 이해하고 싶은 어린이·청소년들,L311
1593,만화 바로보는 세계사 10_제2차 세계대전과 냉전체제,주니어김영사 편저,기타,제2차 세계대전과 냉전 시대의 국제 관계에 호기심 많은 초등 고학년 학생들과 현대 국제 질서의 형성 과정을 배우고 싶은 어린이·청소년들,L312
1594,백수에서 사장이 된 삼촌,어린이경제교육연구회 편저 / 박정환 그림,기타,경제와 창업에 관심 있는 초등학생들과 자녀에게 기업가 정신과 경제 관념을 쉽고 재미있게 가르치고 싶은 학부모님들,L313
1595,버는 것보다 쓰는 것이 중요해요,어린이경제교육연구회 편저 / 박정환 그림,기타,경제 관념과 금융 교육에 관심 있는 초등학생들과 자녀에게 올바른 소비 습관을 길러주고 싶은 학부모님들,L314
1596,나라 사이에 물건을 사고팔아요,어린이경제교육연구회 편저 / 최복기 그림,기타,국제 무역의 기본 원리에 호기심 많은 초등학생들과 경제 교육의 중요성을 인식하는 학부모님들과 교사들,L315
1597,나라마다 돈의 가치가 달라요,어린이경제교육연구회 편저 / 조미현 그림,기타,환율과 국제 금융의 기초 개념에 관심 있는 초등학생들과 글로벌 경제 감각을 키워주고 싶은 학부모님들,L316
1598,수입과 수출을 사이좋게,어린이경제교육연구회 편저 / 최복기 그림,기타,국제 무역 수지와 경제 협력의 중요성에 호기심 많은 초등학생들과 경제 원리를 쉽게 설명해주고 싶은 학부모님들과 교사들,L317
1599,만화로 떠나는 성경 여행 1,김수영 지음 / 비타컴 그림,기타,성경 이야기를 재미있게 배우고 싶은 초등학생들과 자녀에게 종교적 가치관과 인문학적 소양을 함께 키워주고 싶은 학부모님들,L318
1600,만화로 떠나는 성경 여행 2,김수영 지음 / 비타컴 그림,기타,성경의 주요 인물과 사건에 관심 있는 초등학생들과 종교 교육을 재미있고 친근하게 접근하고 싶은 학부모님들과 교사들,L319
1601,만화로 떠나는 성경 여행 3,김수영 지음 / 비타컴 그림,기타,성경 이야기를 재미있게 접하고 싶은 8~13세 기독교 가정 어린이들· 교회 주일학교나 성경공부에 활용하기 좋은 자료를 찾는 청소년부 교사들· 만화를 통해 성경의 주요 사건과 인물을 쉽게 이해하고 싶은 초등학생들,L320
1602,만화로 떠나는 성경 여행 4,김수영 지음 / 비타컴 그림,기타,성경의 역사와 배경 지식을 만화로 배우고 싶은 초등학생들· 기독교 신앙 교육에 활용할 수 있는 자료를 찾는 부모와 교사들· 성경 속 이야기와 교훈을 쉽고 재미있게 접하고 싶은 8~13세 어린이들,L321
1603,만화로 떠나는 성경 여행 5,김수영 지음 / 비타컴 그림,기타,재미있는 만화를 통해 성경 지식을 쌓고 싶은 초등 중·고학년 학생들· 기독교 가정에서 자녀의 신앙 교육을 위한 자료를 찾는 부모님들· 성경의 역사적 배경과 인물들의 이야기에 관심 있는 8~13세 어린이들,L322
1604,만화로 떠나는 성경 여행 6,김수영 지음 / 비타컴 그림,기타,성경 속 인물들의 이야기를 흥미롭게 배우고 싶은 8~13세 기독교 가정 어린이들· 교회 주일학교나 성경공부 교재로 활용하고 싶은 교사와 부모님들· 만화를 통해 성경의 가르침을 재미있게 접하고 싶은 초등학생들,L323
1605,만화로 떠나는 성경 여행 7,김수영 지음 / 비타컴 그림,기타,성경의 세계를 이해하기 쉽게 접근하고 싶은 초등 중·고학년 학생들· 기독교 신앙 교육에 효과적인 자료를 찾는 부모와 교사들· 만화로 보는 성경 이야기를 통해 영적 가치관을 형성하고 싶은 8~13세 어린이들,L324
1606,만화로 떠나는 성경 여행 8,김수영 지음 / 비타컴 그림,기타,성경 속 중요한 사건과 인물을 만화로 배우고 싶은 초등학생들· 기독교 가정에서 자녀와 함께 성경을 공부하고 싶은 부모님들· 재미있는 그림과 이야기로 성경의 가르침을 이해하고 싶은 8~13세 어린이들,L325
1607,만화로 떠나는 성경 여행 9,김수영 지음 / 비타컴 그림,기타,성경의 가르침을 쉽고 재미있게 배우고 싶은 8~13세 기독교 가정 어린이들· 교회 주일학교나 성경공부에 활용할 수 있는 자료를 찾는 교사들· 만화를 통해 성경의 진리를 이해하고 싶은 초등 중·고학년 학생들,L326
1608,만화로 떠나는 성경 여행 10,김수영 지음 / 비타컴 그림,기타,메시아의 탄생과 관련된 성경 이야기를 만화로 접하고 싶은 초등학생들· 기독교 신앙 교육에 즐거움을 더하고 싶은 부모와 교사들· 성경의 역사적 배경과 인물들의 이야기에 흥미를 가진 8~13세 어린이들,L327
1609,만화로 떠나는 성경 여행 11,김수영 지음 / 비타컴 그림,기타,성경 속 예수님의 가르침과 사역을 만화로 배우고 싶은 초등학생들· 기독교 가정에서 자녀의 신앙 교육을 위한 자료를 찾는 부모님들· 재미있는 그림과 이야기로 성경의 메시지를 이해하고 싶은 8~13세 어린이들,L328
1610,만화로 떠나는 성경 여행 12,김수영 지음 / 비타컴 그림,기타,성경의 완성과 초대교회 이야기를 만화로 배우고 싶은 8~13세 기독교 가정 어린이들· 교회 주일학교나 성경공부에 활용할 수 있는 자료를 찾는 교사와 부모님들· 만화를 통해 성경의 전체적인 흐름을 이해하고 싶은 초등 중·고학년 학생들,L329
1611,"제시야, 그만 자!",리비 글리슨 지음 / 프레야 블랙우드 그림 / 엄혜숙 옮김,유아,잠투정이 있는 아이를 둔 부모와 3~6세 유아들· 아이와 엄마의 따뜻한 관계를 그림책으로 느끼고 싶은 가족들· 잠자기 전 읽기 좋은 편안하고 재미있는 그림책을 찾는 양육자들,J001
1612,엘자의 달고양이,알리스 브리에르아케 지음 / 마갈리 르 위슈 그림 / 조은수 옮김,유아,고양이와 동물을 좋아하는 4~7세 어린이들· 상상력과 판타지가 가득한 그림책을 즐기는 유아들· 따뜻한 우정과 교감에 대한 이야기를 아이와 나누고 싶은 부모님들,J002
1613,타임슬립 박물관,희원 지음 / 금동이책 그림,유아,역사와 박물관에 호기심 많은 5~8세 어린이들· 상상력을 자극하는 시간여행 이야기를 좋아하는 유아들· 재미있는 방식으로 문화유산과 역사에 관심을 키우고 싶은 부모님들,J003
1614,영리한 거미 아난시,바바라 칸티니 그림 / 수지 린 다시 씀 / 서보현 옮김,유아,전래동화와 세계 민담에 관심 있는 4~7세 어린이들· 지혜와 꾀를 발휘하는 동물 이야기를 좋아하는 유아들· 다양한 문화의 이야기를 통해 아이의 세계관을 넓히고 싶은 부모님들,J004
1615,초보자가 곰을 만났을 때 알아야 할 모든 것,미셀 로빈슨 지음 / 데이비드 로버츠 그림 / 조현권 옮김,유아,유머와 위트가 담긴 그림책을 좋아하는 4~8세 어린이들· 모험심과 용기를 키워주는 이야기를 찾는 부모님들· 상상력이 풍부한 문제 해결 방식을 배우고 싶은 유아들,J005
1616,내 동생 보러 와!,김기정 지음,유아,동생이 생긴 3~6세 유아들· 형제 관계와 가족의 변화에 적응하는 과정을 이야기로 나누고 싶은 부모님들· 새 가족의 탄생을 앞둔 아이들에게 읽어주기 좋은 그림책을 찾는 양육자들,J006
1617,작은 애벌레의 커다란 꿈 ,기소 히데오 지음,유아,자연과 생명의 성장 과정에 호기심 많은 3~6세 유아들· 꿈과 성장에 관한 따뜻한 메시지가 담긴 그림책을 찾는 부모님들· 애벌레의 변신 과정을 통해 희망과 변화를 배우고 싶은 어린이들,J007
1618,달과 거짓말쟁이,기소 히데오 지음 / 유문조 옮김,유아,상상력이 풍부한 이야기를 좋아하는 4~7세 어린이들· 거짓말과 진실에 대한 가치관을 자연스럽게 형성하고 싶은 유아들· 아이와 함께 도덕적 가치에 대해 대화하고 싶은 부모님들,J008
1619,웃기는 내 고양이,리디아 몽크스 지음,유아,고양이와 반려동물을 좋아하는 3~6세 유아들· 유머와 재미가 가득한 그림책을 통해 웃음을 나누고 싶은 가족들· 동물과의 교감과 애정을 배우고 싶은 어린이들,J009
1620,입을 크게 벌려요,모로하라 지로 지음,유아,일상적인 습관과 행동을 재미있게 배우고 싶은 2~5세 유아들· 신체 인식과 건강한 생활 습관을 길러주고 싶은 부모님들· 참여형 그림책으로 아이와 상호작용하며 읽고 싶은 양육자들,J010
1621,줄줄이 이야기 책,말라키 도일 지음 / 로완 마틴 그림 / 조은수 옮김,유아,반복되는 패턴과 운율을 좋아하는 3~6세 유아들· 창의적 사고와 언어 발달을 돕는 그림책을 찾는 부모님들· 함께 이야기를 만들며 상상력을 키우고 싶은 어린이들,J011
1622,아기 곰의 가을 나들이,데지마 게이자부로 지음 / 정근 옮김,유아,계절의 변화와 자연에 호기심 많은 2~5세 유아들· 따뜻한 가족 이야기와 모험을 좋아하는 어린이들· 아이에게 계절감과 자연의 아름다움을 느끼게 해주고 싶은 부모님들,J012
1623,깃털 옷을 입은 엠마,페데리코 반 룬터 지음 / 한소영 옮김,유아,자신만의 개성과 다양성을 존중하는 메시지를 배우고 싶은 4~7세 어린이들· 상상력과 창의성이 돋보이는 그림책을 찾는 부모님들· 자기표현과 자신감에 관한 이야기를 좋아하는 유아들,J013
1624,이상한 화요일,데이비드 위즈너 지음 ,유아,상상력이 풍부한 판타지 그림책을 좋아하는 4~8세 어린이들· 글 없는 그림책을 통해 창의적 사고를 키우고 싶은 유아들· 아이와 함께 이야기를 만들며 소통하고 싶은 부모님들,J014
1625,커다란 방귀 ,강경수 지음,유아,유머와 재미있는 신체 표현에 흥미를 느끼는 3~6세 유아들· 웃음과 공감을 통해 아이와 즐거운 시간을 보내고 싶은 부모님들· 솔직하고 유쾌한 일상 이야기를 좋아하는 어린이들,J015
1626,박물관에서 기막힌 일이 벌어졌어요!,다비드 칼리 지음 / 벵자맹 쇼 그림 / 허은실 옮김,유아,박물관과 예술에 호기심 많은 5~8세 어린이들· 상상력과 모험심을 자극하는 이야기를 좋아하는 유아들· 문화예술에 대한 관심을 재미있게 키워주고 싶은 부모님들,J016
1627,내 생일이란 말이야,진 윌리스 지음 / 토니 로스 그림,유아,생일과 특별한 날에 대한 기대감이 큰 3~6세 유아들· 감정 표현과 자기주장을 자연스럽게 배우고 싶은 어린이들· 아이의 감정에 공감하며 소통하고 싶은 부모님들,J017
1628,열덟 살 오지 마!,재희 지음,유아,성장과 나이 듦에 대한 호기심이 많은 4~7세 어린이들· 미래에 대한 상상력을 키우고 싶은 유아들· 아이의 성장 과정을 긍정적으로 이야기하고 싶은 부모님들,J018
1629,정현이의 약속,홍혜경 지음 / 이루미 그림,유아,약속의 중요성과 책임감을 배우고 싶은 4~7세 어린이들· 일상 속 작은 도덕적 가치를 전하고 싶은 부모님들· 관계 속에서 신뢰를 쌓아가는 과정을 배우고 싶은 유아들,J019
1630,하얀 눈의 속삭임 ,케이트 웨스터런드 지음 / 페리던 오럴 그림 / 김경미 옮김,유아,겨울과 눈에 대한 감성적 경험을 좋아하는 3~7세 어린이들· 계절의 아름다움과 자연의 변화를 느끼게 해주고 싶은 부모님들· 시적인 언어와 아름다운 그림에 감수성을 키우고 싶은 유아들,J020
1631,위대한 가족,윤진현 지음,유아,가족의 의미와 소중함을 배우고 싶은 3~7세 어린이들· 다양한 가족 형태에 대해 열린 마음을 키워주고 싶은 부모님들· 사랑과 포용의 가치를 그림책으로 느끼고 싶은 유아들,J021
1632,로자와 잠가루,브리짓민느 지음,유아,잠과 수면에 관한 상상력 넘치는 이야기를 좋아하는 3~6세 유아들· 잠자기 전 읽기 좋은 편안한 그림책을 찾는 부모님들· 일상의 습관을 재미있게 이야기로 풀어내는 그림책을 좋아하는 어린이들,J022
1633,꿈 별나라 풍선 여행,윤지유 지음 / 박성은 글,유아,꿈과 상상의 세계를 탐험하고 싶은 3~6세 유아들· 아이의 상상력과 창의력을 키워주고 싶은 부모님들· 잠들기 전 평온한 마음을 갖게 해주는 그림책을 찾는 양육자들,J023
1634,노란 공이 통통통,다카야 마치코 지음,유아,색과 움직임에 호기심 많은 1~4세 영유아들· 단순하고 리드미컬한 이야기로 언어 발달을 돕고 싶은 부모님들· 아이와 함께 소리 내어 읽으며 상호작용하고 싶은 양육자들,J024
1635,편지 왔어요! 편지,기린 안 지음 / 요시무라 한나 그림,유아,소통과 교류의 즐거움을 배우고 싶은 3~6세 유아들· 전통적인 편지 문화에 대해 알려주고 싶은 부모님들· 관계 맺기와 감정 표현의 다양한 방법을 배우고 싶은 어린이들,J025
1636,울퉁이와 삐리의 하늘 여행,하기노 치나츠 지음,유아,모험과 우정에 관한 이야기를 좋아하는 3~6세 유아들· 상상력과 창의력을 자극하는 그림책을 찾는 부모님들· 하늘과 비행에 호기심 많은 어린이들,J026
1637,"똑똑똑, 나랑 놀자",이상교 지음 / 이은선 그림,유아,친구 사귐과 사회성 발달에 도움이 필요한 2~5세 유아들· 놀이와 관계 맺기의 즐거움을 알려주고 싶은 부모님들· 또래와의 상호작용을 재미있게 배우고 싶은 어린이들,J027
1638,아기 힘이 세졌어요,존 버닝햄 지음,유아,성장과 발달에 자부심을 느끼는 2~5세 유아들· 아이의 성취감과 자신감을 키워주고 싶은 부모님들· 독립심과 자율성 발달을 응원하는 그림책을 찾는 양육자들,J028
1639,네가 친구라서 참 좋아,울리히 마스케 지음,유아,친구 관계와 우정의 가치를 배우고 싶은 3~6세 유아들· 사회성과 정서 발달을 돕는 그림책을 찾는 부모님들· 따뜻한 관계 맺기와 감정 표현을 배우고 싶은 어린이들,J029
1640,내 곰 인형은 하루 종일 무얼 할까?,브루노 해흘러 지음 / 비르테 뮐러 그림,유아,인형과 장난감에 생명을 불어넣는 상상력이 풍부한 3~6세 유아들· 아이의 창의적 사고를 자극하는 그림책을 찾는 부모님들· 일상 속 판타지와 상상의 즐거움을 느끼고 싶은 어린이들,J030
1641,뚱뚱이와 홀쭉이,파트리시아 베르비 지음 / 클라우디아 비엘린스키 그림,유아,신체 다양성과 외모에 대한 건강한 인식을 키우고 싶은 4~7세 어린이들· 편견 없는 시각과 수용적 태도를 가르치고 싶은 부모님들· 자신과 타인을 있는 그대로 받아들이는 법을 배우고 싶은 유아들,J031
1642,호기심 많은 물고기 모모,버나드 와버 지음 / 허은실 옮김,유아,해양 생물과 바다 세계에 호기심 많은 3~6세 유아들· 탐험과 발견의 즐거움을 알려주고 싶은 부모님들· 호기심과 질문의 가치를 배우고 싶은 어린이들,J032
1643,틀리면 어떡해? ,김영진 지음,유아,실수와 실패에 대한 두려움이 있는 4~7세 어린이들· 아이에게 도전 정신과 회복 탄력성을 키워주고 싶은 부모님들· 완벽주의 성향에서 벗어나 실수를 통해 배우는 가치를 알고 싶은 유아들,J033
1644,친구 사귀기,김영진 지음,유아,사회성 발달 단계에 있는 3~6세 유아들· 또래 관계와 친구 사귐에 어려움을 겪는 어린이들· 아이의 건강한 대인관계 형성을 돕고 싶은 부모님과 교사들,J034
1645,빨간 깃털 ,벤 키친 지음 / 오웬 스완 그림 / 서보현 옮김,유아,자연과 동물에 대한 호기심이 많은 3~6세 유아들· 발견과 탐색의 즐거움을 경험하게 해주고 싶은 부모님들· 아름다운 일러스트와 자연의 경이로움을 느끼고 싶은 어린이들,J035
1646,책상_잘 쓰는 법,이고은 지음 ,유아,바른 학습 습관을 길러주고 싶은 5~7세 유아들· 취학 전 아이에게 기본 생활 습관을 가르치고 싶은 부모님들· 정리 정돈과 공간 활용의 중요성을 배우고 싶은 어린이들,J036
1647,음식 잘 먹는 법,윤은주 지음 / 강영지 그림,유아,편식 습관이 있는 3~6세 유아들· 건강한 식습관을 재미있게 가르치고 싶은 부모님들· 음식의 중요성과 식사 예절을 배우고 싶은 어린이들,J037
1648,마술 연필,앤서니 브라운과 꼬마 작가들 지음,유아,창의적 글쓰기와 그림 그리기에 관심 있는 4~8세 어린이들· 아이의 상상력과 표현력을 키워주고 싶은 부모님들· 예술적 영감과 창작의 즐거움을 느끼고 싶은 유아들,J038
1649,우리 형,앤서니 브라운 지음,유아,형제 관계와 가족 내 역할에 관심 있는 3~7세 유아들· 형제간 우애와 갈등을 자연스럽게 이해시키고 싶은 부모님들· 가족 구성원으로서의 정체성을 형성하고 있는 어린이들,J039
1650,악어 형사의 감정 탐구 생활,수산나 이세른 지음 / 모니카 카레테로 그림 / 김서윤 옮김,유아,다양한 감정을 인식하고 표현하는 법을 배우고 싶은 4~7세 어린이들· 아이의 정서 지능을 발달시키고 싶은 부모님들· 재미있는 캐릭터를 통해 감정 조절 능력을 키우고 싶은 유아들,J040
1651,우리 엄마,앤서니 브라운 지음,유아,엄마와의 특별한 유대감을 느끼고 싶은 3~6세 유아들· 모성과 가족애에 대한 따뜻한 메시지를 전하고 싶은 부모님들· 일상 속 엄마의 다양한 모습과 사랑을 이해하고 싶은 어린이들,J041
1652,페페 가로등을 켜는 아이,일라이자 바튼 지음 / 테드 르윈 그림 / 서남희 옮김,유아,용기와 책임감에 대한 이야기를 좋아하는 4~7세 어린이들· 공동체 의식과 타인에 대한 배려를 가르치고 싶은 부모님들· 작은 일에도 큰 의미가 있음을 배우고 싶은 유아들,J042
1653,가족 요리 대회에 나갈 거야!,이문수 지음 / 황성혜 그림,유아,요리와 음식에 관심 많은 4~7세 어린이들· 가족 활동과 협력의 즐거움을 경험하게 해주고 싶은 부모님들· 도전과 성취의 기쁨을 배우고 싶은 유아들,J043
